title,source,url,urlToImage,description,author,publishedAt,t_score,d_score
Tesla випустила ексклюзивні дошки для серфінгу,"{'id': None, 'name': 'Golosherson.co.ua'}",https://golosherson.co.ua/tesla-vipystila-ekskluzivni-doshki-dlia-serfingy/94947/,https://golosherson.co.ua/wp-content/uploads/2018/07/fc939e8093c51b99e3acd4fe2d60a1ae-300x150.jpeg,,,2018-07-29T20:04:15Z,-0.5095519989067516,0
200 досок для серфинга Tesla продали за 15 часов,"{'id': None, 'name': 'Rambler.ru'}",https://weekend.rambler.ru/items/40440543-200-dosok-dlya-serfinga-tesla-prodali-za-15-chasov/,https://weekend.rambler.ru/share/snippet/?project=weekend&urgent=False&image=https%3A%2F%2Fnews.rambler.ru%2Fimg%2F2018%2F07%2F29212057.225102.4775.JPG&big=False&title=200%C2%A0%D0%B4%D0%BE%D1%81%D0%BE%D0%BA+%D0%B4%D0%BB%D1%8F%C2%A0%D1%81%D0%B5%D1%80%D1%84%D0%B8%D0%BD%D0%B3%D0%B0+Tesla+%D0%BF%D1%80%D0%BE%D0%B4%D0%B0%D0%BB%D0%B8+%D0%B7%D0%B0%C2%A015%C2%A0%D1%87%D0%B0%D1%81%D0%BE%D0%B2,"Компания Илона Маска Tesla выпускает не только электокары, но и самые разные брендированные вещи.",,2018-07-29T19:11:38Z,-0.5461194612546983,-0.5095519989067516
"Tesla released a $1500 surfboard, and it sold out in a matter of hours","{'id': None, 'name': 'Cityam.com'}",http://www.cityam.com/289921/tesla-released-1500-surfboard-and-sold-out-matter-hours,http://www.cityam.com/assets/uploads/main-image/full_width_article_body_image/2018/07/tesla-surfboard-5b5e0aad168c9-5b5e0cfc89abd.jpg,"Tesla debuted a new product on Saturday night, in the form of a perfectly normal surfboard.",Emily Nicolle,2018-07-29T19:07:02Z,0.4411578340563659,-0.5269648832333819
Tesla briefly offered a $1500 surfboard,"{'id': 'the-verge', 'name': 'The Verge'}",https://www.theverge.com/2018/7/29/17627664/tesla-surfboard-sold-out-merchandise,https://cdn.vox-cdn.com/thumbor/mhiV0oteDHiOsgq8YFJ6prImVTg=/34x0:1482x758/fit-in/1200x630/cdn.vox-cdn.com/uploads/chorus_asset/file/11840087/Tesla_surfboard_header_e1532787215687.jpg,"Elon Musk has come up withs some interesting merchandise to promote his companies: he sold Boring Company hats and then a branded flame thrower. Yesterday, his electric car company Tesla released a new product: a $1500 surfboard.",Andrew Liptak,2018-07-29T19:01:41Z,-0.5949369907720289,-0.7303024021599867
"Twitter bo blokiral račun, če boste ime spremenili v »Elon Musk«","{'id': None, 'name': 'Delo.si'}",https://www.delo.si/novice/znanoteh/twitter-vam-bo-blokiral-racun-ce-boste-ime-spremenili-v-elon-musk-76396.html,https://www.delo.si/images/slike/2018/07/29/djvu_2580224_stojiljg_reutUSAG.jpg,"Elon Musk je na twitterju med bolj dejavnimi  in priljubljenimi. To so začeli spretno izkoriščati tudi nepridipravi, ki so se pojavili po objavah šefa avtomobilskega podjetja Tesla in vesoljskega...",Saša Senica,2018-07-29T17:00:56Z,0.5531786923567937,0.5279281810096611
Earnings Watch: Even Apple takes a back seat to Elon Musk right now,"{'id': None, 'name': 'Marketwatch.com'}",https://www.marketwatch.com/story/earnings-watch-even-apple-takes-a-back-seat-to-elon-musk-right-now-2018-07-29,http://s.marketwatch.com/public/resources/MWimages/MW-GC633_Tesla0_ZG_20180129125655.jpg,"Both Apple and Tesla Inc. are set to report earnings this coming week, but the car maker’s release is likely to steal the show.",Emily Bary,2018-07-29T15:39:00Z,0.49561194606953224,0.536092863968631
Le nouveau produit Tesla est… une planche de surf !,"{'id': None, 'name': 'Presse-citron.net'}",https://www.presse-citron.net/nouveau-produit-tesla-planche-surf/,https://www.presse-citron.net/wordpress_prod/wp-content/uploads/2018/07/Planche-Surf-Tesla.jpg,"Tout est bon pour faire un peu de trésorerie. Après la mini station de recharge pour mobile, le lancement flamme, la nouvelle idée d'Elon Musk : une planche de surf.",Vincent Bouvier,2018-07-29T14:49:00Z,0.5033280842280565,0.49842056312486444
A Tesla csinált 200 szörfdeszkát,"{'id': None, 'name': 'Index.hu'}",https://index.hu/tech/2018/07/29/a_tesla_csinalt_200_szorfdeszkat/,https://kep.cdn.index.hu/1/0/2063/20636/206368/20636858_1309542_6420bb0cdde1abb1879eb0f6ba3080e4_wm.png,"A Tesla csinált 200 szörfdeszkát - Darabját 1500 dollárért árulták, mind elfogyott.",Domschitz Mátyás,2018-07-29T08:41:00Z,-0.5502920501509954,-0.5399017217902187
Karşınızda Tesla'nın sınırlı sayıda üretmiş olduğu karbon fiber sörf tahtaları,"{'id': None, 'name': 'Donanimhaber.com'}",https://www.donanimhaber.com/diger-bilim-ve-teknoloji/haberleri/Karsinizda-Teslanin-sinirli-sayida-uretmis-oldugu-karbon-fiber-sorf-tahtalari.htm,https://img.donanimhaber.com/images/haber/101898/600x338Karsinizda-Teslanin-sinirli-sayida-uretmis-oldugu-karbon-fiber-sorf-tahtalari.jpg,"Tesla Motors, dünyaca ünlü sörf tahtası üreticisi Lost Surfboards ile iş birliği yaparak sörf tahtası üretmeye başladığını duyurdu. Tesla Surfboard 1500 dolara alıcıyla buluşacak.",Zeynep Yolcu,2018-07-29T08:06:08Z,-0.5095519989067516,-0.6021231992555691
